{
  "meta": {
    "title": "ПочваСвет: что делать по результатам тестов",
    "version": "2026-10-11",
    "disclaimer": "Дозы — ориентиры для малых хозяйств на дерново-подзолистых почвах Беларуси. Перед массовым применением сверяйте их с рекомендациями Института почвоведения и агрохимии НАН Беларуси. На торфяных почвах и землях с радиоактивным загрязнением действуйте по агрохимическому паспорту поля."
  },
  "lights": {
    "green": {"emoji": "🟢", "name": "Зелёный", "rank": 0, "hint": "в норме"},
    "yellow": {"emoji": "🟡", "name": "Жёлтый", "rank": 1, "hint": "обрати внимание"},
    "red": {"emoji": "🔴", "name": "Красный", "rank": 2, "hint": "действуй сейчас"}
  },
  "questions": [
    {"id": "texture", "text": "Какой механический состав почвы (проба «жгут»)?", "required": true, "options": [
      {"id": "sand", "label": "Песок — шнур не раскатывается"},
      {"id": "sandy_loam", "label": "Супесь — раскатывается, но крошится"},
      {"id": "loam", "label": "Суглинок — шнур или кольцо держится"}
    ]},
    {"id": "crop", "text": "Что будете выращивать на этом поле?", "required": true, "options": [
      {"id": "grain", "label": "Зерновые (рожь, пшеница, ячмень, овёс)"},
      {"id": "potato", "label": "Картофель"},
      {"id": "veg", "label": "Овощи (капуста, свёкла, морковь, лук)"}
    ]},
    {"id": "ph", "indicator": "ph", "text": "Какой цвет в лунке pH?"},
    {"id": "carb", "indicator": "carb", "text": "Шипит ли почва с уксусом?"},
    {"id": "n", "indicator": "n", "text": "Нитраты: какой цвет полоски (или показание, мг/л)?"},
    {"id": "p", "indicator": "p", "text": "Фосфор: какая синяя окраска?"},
    {"id": "k", "indicator": "k", "text": "Калий: что видно сквозь пробирку?"},
    {"id": "org_color", "indicator": "org_color", "text": "Органика: цвет влажной почвы по шкале?"},
    {"id": "org_foam", "indicator": "org_foam", "text": "Органика: высота пены с перекисью через 3 минуты?"},
    {"id": "org_worms", "indicator": "org_worms", "text": "Органика: сколько червей в кубике 20×20×20 см?"},
    {"id": "manure", "text": "Вносили навоз, помёт или аммонийные удобрения за последние 3 недели?", "required": true, "options": [
      {"id": "no", "label": "Нет"},
      {"id": "yes", "label": "Да"}
    ]},
    {"id": "area", "text": "Какая площадь поля? (для пересчёта в килограммы удобрения)", "required": true, "options": [
      {"id": "100", "label": "1 сотка"},
      {"id": "600", "label": "6 соток"},
      {"id": "1000", "label": "10 соток"},
      {"id": "2500", "label": "25 соток"},
      {"id": "10000", "label": "1 га"},
      {"id": "50000", "label": "5 га"},
      {"id": "200000", "label": "20 га"},
      {"id": "0", "label": "Не считать"}
    ]}
  ],
  "indicators": [
    {
      "id": "ph", "name": "Кислотность (pH KCl)", "chapter": "2",
      "intro": "Если pH красный, первое дело сезона — известкование: без него фосфор и калий окупаются плохо.",
      "levels": [
        {"id": "ph1", "button": "Красный — pH ≤4,5", "title": "pH ≤4,5 — очень сильнокислая", "light": "red",
         "meaning": "Подвижный алюминий повреждает корни, корень не идёт вглубь, растения страдают от засухи даже при нормальных осадках. Фосфор связывается железом и алюминием. Не растут клевер, люцерна, ячмень, капуста, свёкла.",
         "actions": ["Известковать этой осенью полной дозой; если доза больше 6 т/га — в два приёма с интервалом в год.", "До известкования сеять только кислотоустойчивые культуры: озимую рожь, овёс, люпин, картофель.", "Повторить тест pH через год после внесения."],
         "lime": {"sand": [4, 5], "sandy_loam": [5, 6], "loam": [6, 7]}},
        {"id": "ph2", "button": "Оранжево-красный — pH 4,6–5,0", "title": "pH 4,6–5,0 — сильнокислая", "light": "red",
         "meaning": "Чувствительные культуры дают заметно меньший урожай; удобрения работают вполсилы.",
         "actions": ["Известковать этой осенью полной дозой.", "Под картофель известковать предшествующую культуру, а не прямо перед посадкой."],
         "lime": {"sand": [3, 4], "sandy_loam": [4, 5], "loam": [5, 6]}},
        {"id": "ph3", "button": "Оранжевый — pH 5,1–5,5", "title": "pH 5,1–5,5 — среднекислая", "light": "yellow",
         "meaning": "Страдают ячмень, капуста, свёкла, бобовые; картофель, рожь и овёс растут нормально.",
         "actions": ["Известковать в течение 1–2 лет, в первую очередь поля под чувствительные культуры.", "Не применять подкисляющие удобрения (сульфат аммония) без извести."],
         "lime": {"sand": [2, 3], "sandy_loam": [3, 4], "loam": [4, 5]}},
        {"id": "ph4", "button": "Жёлто-оранжевый — pH 5,6–6,0", "title": "pH 5,6–6,0 — слабокислая", "light": "green",
         "light_rules": [{"when": {"texture": ["loam"]}, "light": "yellow"}],
         "meaning": "Для песка и супеси это оптимум; для суглинка — нижняя граница нормы.",
         "actions": ["На песке и супеси ничего не менять, повторить тест через 3 года.", "На суглинке под капусту, свёклу и ячмень — поддерживающее известкование 2–4 т/га."],
         "lime": {"loam": [2, 4]}},
        {"id": "ph5", "button": "Жёлтый/жёлто-зелёный — pH 6,1–7,0", "title": "pH 6,1–7,0 — близкая к нейтральной", "light": "green",
         "meaning": "Оптимальная реакция для большинства культур.",
         "actions": ["Не известковать; повторить тест через 3–4 года.", "Для картофеля при pH выше 6,5 — сорта, устойчивые к парше; без извести и золы перед посадкой."]},
        {"id": "ph6", "button": "Зелёный/сине-зелёный — pH >7,0", "title": "pH >7,0 — избыток извести", "light": "yellow",
         "meaning": "Хуже доступны железо, марганец, бор, цинк; на картофеле — парша, на молодых листьях возможно межжилковое пожелтение.",
         "actions": ["Извести и золы не вносить.", "Азот давать в форме сульфата аммония или карбамида.", "Вносить органику (навоз, компост, торф).", "При пожелтении молодых листьев — подкормка по листу хелатами микроэлементов."]}
      ]
    },
    {
      "id": "carb", "name": "Карбонаты (тест с уксусом)", "chapter": "2.4",
      "intro": "Шипение с уксусом показывает свободную известь в почве.",
      "levels": [
        {"id": "carb0", "button": "Не шипит", "title": "Шипения нет", "light": "green",
         "meaning": "Свободной извести нет — обычное состояние дерново-подзолистой почвы.",
         "actions": ["Решение об известковании принимать по pH."]},
        {"id": "carb1", "button": "Слабо шипит", "title": "Слабое шипение", "light": "yellow",
         "meaning": "Остатки недавнего известкования.",
         "actions": ["Повторно не известковать минимум 2–3 года, даже если pH ещё невысокий."]},
        {"id": "carb2", "button": "Сильно шипит", "title": "Сильное шипение", "light": "yellow",
         "meaning": "Избыток извести или карбонатная почва.",
         "actions": ["Не известковать; действовать как при pH >7,0."]}
      ]
    },
    {
      "id": "n", "name": "Нитратный азот", "chapter": "3",
      "intro": "Нитратный тест отвечает на вопрос, сколько азота дать сейчас. Делайте его весной перед посевом и перед каждой подкормкой.",
      "levels": [
        {"id": "n1", "button": "Бесцветно/едва розовый (0–5 мг/л)", "title": "N-NO₃ <7 мг/кг (запас <30 кг/га)", "light": "red", "reserve": 15,
         "meaning": "Азота почти нет; у взошедших растений — пожелтение и остановка роста.",
         "actions": ["До посева — полная доза азота для культуры в рекомендованные приёмы.", "Если растения уже бледнеют — подкормка сейчас: 30–40 кг N/га (на огороде 7–9 г карбамида на м² с поливом)."],
         "n_mode": "full"},
        {"id": "n2", "button": "Светло-розовый (10 мг/л)", "title": "N-NO₃ 7–15 мг/кг (запас 30–60 кг/га)", "light": "yellow", "reserve": 45,
         "meaning": "Запас азота ниже потребности культуры.",
         "actions": ["Доза = полная доза культуры минус запас по тесту."],
         "n_mode": "minus_reserve"},
        {"id": "n3", "button": "Розовый/малиновый (25 мг/л)", "title": "N-NO₃ 15–40 мг/кг (запас 60–160 кг/га)", "light": "green",
         "meaning": "Азота хватит на 2–4 недели.",
         "actions": ["Плановую подкормку отложить; повторить тест через 2–3 недели или перед следующей фазой."],
         "n_mode": "none"},
        {"id": "n4", "button": "Тёмно-малиновый/фиолетовый (50+ мг/л)", "title": "N-NO₃ >40 мг/кг — избыток", "light": "yellow",
         "meaning": "Риск полегания зерновых, нитратов в овощах, затягивания созревания картофеля, вымывания.",
         "actions": ["Азот не вносить.", "Листовые овощи и зелень не подкармливать до уборки."],
         "n_mode": "none"}
      ]
    },
    {
      "id": "p", "name": "Фосфор (P₂O₅ по Кирсанову)", "chapter": "4",
      "intro": "Фосфор вносят по группе: в бедные почвы с запасом, в средние — по выносу, в богатые — не вносят.",
      "levels": [
        {"id": "p1", "button": "Бесцветно/едва голубоватый — I", "title": "I группа: ≤60 мг/кг — очень низкая", "light": "red",
         "meaning": "Слабые корни, задержка развития, фиолетовый оттенок листьев, плохое кущение.",
         "actions": ["Полная доза: половина осенью под вспашку, половина локально при посеве (рядки, борозды, лунки).", "На кислой почве сначала известь.", "Повторять тест ежегодно до выхода в III–IV группу."],
         "dose": {"grain": [70, 90], "potato": [90, 120], "veg": [100, 120]}},
        {"id": "p2", "button": "Бледно-голубой — II", "title": "II группа: 61–100 мг/кг — низкая", "light": "red",
         "meaning": "Фосфора мало для нормального урожая.",
         "actions": ["Полная доза; часть — локально при посеве.", "На кислой почве сначала известь."],
         "dose": {"grain": [60, 70], "potato": [80, 100], "veg": [80, 100]}},
        {"id": "p3", "button": "Голубой — III", "title": "III группа: 101–150 мг/кг — средняя", "light": "yellow",
         "meaning": "Хватает для среднего урожая, но не для высокого.",
         "actions": ["Доза по таблице, предпочтительно аммофос локально весной."],
         "dose": {"grain": [40, 60], "potato": [60, 80], "veg": [60, 80]}},